{
  "id": "x8f42a0b151324e96ac3c8591b75fd204",
  "name": "Broken corner",
  "instruction": "Bevel this corner without changing the doorway.",
  "scene": "room/main",
  "context": "day",
  "node_path": "Gatehouse",
  "position": [2, 3, 4],
  "radius": 0,
  "status": "draft",
  "engine": "custom",
  "coordinate_system": {"unit": "meter", "up_axis": "Y", "forward_axis": "-Z"},
  "targets": [{"node_path": "Gatehouse", "name": "Gatehouse", "type": "mesh", "scene": "room/main", "mesh": "assets/gate.glb"}],
  "strokes": [{"points": [[1, 3, 4], [2, 4, 4], [3, 3, 4]], "normal": [0, 0, 1], "width": 0.04, "color": "ffda67ff", "projection": "plane"}],
  "result": "",
  "created_at": "2026-10-03T00:00:00Z",
  "updated_at": "2026-10-03T00:00:00Z"
}
